{
  "schemaVersion": "2.0.0",
  "stateRevision": "AUTH-V2-03-PRODUCTION-KEEP-2026-09-10",
  "phase": {
    "id": "AUTH-V2",
    "title": "Authentication V2"
  },
  "lastCompleted": {
    "id": "AUTH-V2-03",
    "title": "Recuperação de senha e UX de senha",
    "outcome": "PRODUCTION_KEEP / AUTH-V2-03_LIVE"
  },
  "currentWork": {
    "status": "none"
  },
  "nextTask": {
    "status": "undecided",
    "planningState": "PENDING-PRODUCT-PRIORITIZATION"
  },
  "live": {
    "api": {
      "sourceSha": "c137ff1fb81ac5fc9b94a4b52f4190786477354e",
      "image": "ghcr.io/arthurportodev/genesis-platform-api@sha256:49e52a62de67cb0a37afaa88a70d2da71404c6e8736429716922b91592453759"
    },
    "web": {
      "sourceSha": "8aeb682c6608ba467a47560d751ae51a271abe64",
      "deploymentId": "dpl_AMKoVRsWx3cpzZfYyRyTLH1aHabT",
      "domain": "https://app.agenciagenesismkt.com.br"
    }
  },
  "openBlockers": [],
  "activeRestrictions": [
    {
      "id": "OR-SINGLE-VPS",
      "summary": "Production uses one VPS and one failure domain."
    },
    {
      "id": "OR-SINGLE-REPLICA",
      "summary": "The public API remains limited to one replica while controls are process-local."
    },
    {
      "id": "OR-VERCEL-HOBBY-TECHNICAL-MVP",
      "summary": "Review Vercel plan suitability before external onboarding or expanded commercial use."
    }
  ],
  "followUps": [
    {
      "id": "FU-PIPELINE-CONFLICT-FEEDBACK",
      "summary": "Differentiate Pipeline configuration conflict feedback from stale-revision feedback instead of grouping HTTP 409 and 412 into the same Web message."
    },
    {
      "id": "FU-TASK-VALIDATE-DATABASE-ENV",
      "summary": "Make surface-mode task validation provide the PostgreSQL DATABASE_* environment to database suites so explicit reruns are not required."
    }
  ]
}
